{"modelVersion":"PK one-compartment v1.0","compoundName":"Synthetic Compound Y","route":"oral","doseMg":250.0,"durationHours":48.0,"units":{"time":"h","concentration":"mg/L","auc":"mg\u00b7h/L","dose":"mg","volume":"L","clearance":"L/h"},"timeHours":[0.0,0.05,0.1,0.15,0.2,0.25,0.3,0.35,0.4,0.45,0.5,0.55,0.6,0.65,0.7,0.75,0.8,0.85,0.9,0.95,1.0,1.05,1.1,1.15,1.2,1.25,1.3,1.35,1.4,1.45,1.5,1.55,1.6,1.65,1.7,1.75,1.8,1.85,1.9,1.95,2.0,2.05,2.1,2.15,2.2,2.25,2.3,2.35,2.4,2.45,2.5,2.55,2.6,2.65,2.7,2.75,2.8,2.85,2.9,2.95,3.0,3.05,3.1,3.15,3.2,3.25,3.3,3.35,3.4,3.45,3.5,3.55,3.6,3.65,3.7,3.75,3.8,3.85,3.9,3.95,4.0,4.05,4.1,4.15,4.2,4.25,4.3,4.35,4.4,4.45,4.5,4.55,4.6,4.65,4.7,4.75,4.8,4.85,4.9,4.95,5.0,5.05,5.1,5.15,5.2,5.25,5.3,5.35,5.4,5.45,5.5,5.55,5.6,5.65,5.7,5.75,5.8,5.85,5.9,5.95,6.0,6.05,6.1,6.15,6.2,6.25,6.3,6.35,6.4,6.45,6.5,6.55,6.6,6.65,6.7,6.75,6.8,6.85,6.9,6.95,7.0,7.05,7.1,7.15,7.2,7.25,7.3,7.35,7.4,7.45,7.5,7.55,7.6,7.65,7.7,7.75,7.8,7.85,7.9,7.95,8.0,8.05,8.1,8.15,8.2,8.25,8.3,8.35,8.4,8.45,8.5,8.55,8.6,8.65,8.7,8.75,8.8,8.85,8.9,8.95,9.0,9.05,9.1,9.15,9.2,9.25,9.3,9.35,9.4,9.45,9.5,9.55,9.6,9.65,9.7,9.75,9.8,9.85,9.9,9.95,10.0,10.05,10.1,10.15,10.2,10.25,10.3,10.35,10.4,10.45,10.5,10.55,10.6,10.65,10.7,10.75,10.8,10.85,10.9,10.95,11.0,11.05,11.1,11.15,11.2,11.25,11.3,11.35,11.4,11.45,11.5,11.55,11.6,11.65,11.7,11.75,11.8,11.85,11.9,11.95,12.0,12.05,12.1,12.15,12.2,12.25,12.3,12.35,12.4,12.45,12.5,12.55,12.6,12.65,12.7,12.75,12.8,12.85,12.9,12.95,13.0,13.05,13.1,13.15,13.2,13.25,13.3,13.35,13.4,13.45,13.5,13.55,13.6,13.65,13.7,13.75,13.8,13.85,13.9,13.95,14.0,14.05,14.1,14.15,14.2,14.25,14.3,14.35,14.4,14.45,14.5,14.55,14.6,14.65,14.7,14.75,14.8,14.85,14.9,14.95,15.0,15.05,15.1,15.15,15.2,15.25,15.3,15.35,15.4,15.45,15.5,15.55,15.6,15.65,15.7,15.75,15.8,15.85,15.9,15.95,16.0,16.05,16.1,16.15,16.2,16.25,16.3,16.35,16.4,16.45,16.5,16.55,16.6,16.65,16.7,16.75,16.8,16.85,16.9,16.95,17.0,17.05,17.1,17.15,17.2,17.25,17.3,17.35,17.4,17.45,17.5,17.55,17.6,17.65,17.7,17.75,17.8,17.85,17.9,17.95,18.0,18.05,18.1,18.15,18.2,18.25,18.3,18.35,18.4,18.45,18.5,18.55,18.6,18.65,18.7,18.75,18.8,18.85,18.9,18.95,19.0,19.05,19.1,19.15,19.2,19.25,19.3,19.35,19.4,19.45,19.5,19.55,19.6,19.65,19.7,19.75,19.8,19.85,19.9,19.95,20.0,20.05,20.1,20.15,20.2,20.25,20.3,20.35,20.4,20.45,20.5,20.55,20.6,20.65,20.7,20.75,20.8,20.85,20.9,20.95,21.0,21.05,21.1,21.15,21.2,21.25,21.3,21.35,21.4,21.45,21.5,21.55,21.6,21.65,21.7,21.75,21.8,21.85,21.9,21.95,22.0,22.05,22.1,22.15,22.2,22.25,22.3,22.35,22.4,22.45,22.5,22.55,22.6,22.65,22.7,22.75,22.8,22.85,22.9,22.95,23.0,23.05,23.1,23.15,23.2,23.25,23.3,23.35,23.4,23.45,23.5,23.55,23.6,23.65,23.7,23.75,23.8,23.85,23.9,23.95,24.0,24.05,24.1,24.15,24.2,24.25,24.3,24.35,24.4,24.45,24.5,24.55,24.6,24.65,24.7,24.75,24.8,24.85,24.9,24.95,25.0,25.05,25.1,25.15,25.2,25.25,25.3,25.35,25.4,25.45,25.5,25.55,25.6,25.65,25.7,25.75,25.8,25.85,25.9,25.95,26.0,26.05,26.1,26.15,26.2,26.25,26.3,26.35,26.4,26.45,26.5,26.55,26.6,26.65,26.7,26.75,26.8,26.85,26.9,26.95,27.0,27.05,27.1,27.15,27.2,27.25,27.3,27.35,27.4,27.45,27.5,27.55,27.6,27.65,27.7,27.75,27.8,27.85,27.9,27.95,28.0,28.05,28.1,28.15,28.2,28.25,28.3,28.35,28.4,28.45,28.5,28.55,28.6,28.65,28.7,28.75,28.8,28.85,28.9,28.95,29.0,29.05,29.1,29.15,29.2,29.25,29.3,29.35,29.4,29.45,29.5,29.55,29.6,29.65,29.7,29.75,29.8,29.85,29.9,29.95,30.0,30.05,30.1,30.15,30.2,30.25,30.3,30.35,30.4,30.45,30.5,30.55,30.6,30.65,30.7,30.75,30.8,30.85,30.9,30.95,31.0,31.05,31.1,31.15,31.2,31.25,31.3,31.35,31.4,31.45,31.5,31.55,31.6,31.65,31.7,31.75,31.8,31.85,31.9,31.95,32.0,32.05,32.1,32.15,32.2,32.25,32.3,32.35,32.4,32.45,32.5,32.55,32.6,32.65,32.7,32.75,32.8,32.85,32.9,32.95,33.0,33.05,33.1,33.15,33.2,33.25,33.3,33.35,33.4,33.45,33.5,33.55,33.6,33.65,33.7,33.75,33.8,33.85,33.9,33.95,34.0,34.05,34.1,34.15,34.2,34.25,34.3,34.35,34.4,34.45,34.5,34.55,34.6,34.65,34.7,34.75,34.8,34.85,34.9,34.95,35.0,35.05,35.1,35.15,35.2,35.25,35.3,35.35,35.4,35.45,35.5,35.55,35.6,35.65,35.7,35.75,35.8,35.85,35.9,35.95,36.0,36.05,36.1,36.15,36.2,36.25,36.3,36.35,36.4,36.45,36.5,36.55,36.6,36.65,36.7,36.75,36.8,36.85,36.9,36.95,37.0,37.05,37.1,37.15,37.2,37.25,37.3,37.35,37.4,37.45,37.5,37.55,37.6,37.65,37.7,37.75,37.8,37.85,37.9,37.95,38.0,38.05,38.1,38.15,38.2,38.25,38.3,38.35,38.4,38.45,38.5,38.55,38.6,38.65,38.7,38.75,38.8,38.85,38.9,38.95,39.0,39.05,39.1,39.15,39.2,39.25,39.3,39.35,39.4,39.45,39.5,39.55,39.6,39.65,39.7,39.75,39.8,39.85,39.9,39.95,40.0,40.05,40.1,40.15,40.2,40.25,40.3,40.35,40.4,40.45,40.5,40.55,40.6,40.65,40.7,40.75,40.8,40.85,40.9,40.95,41.0,41.05,41.1,41.15,41.2,41.25,41.3,41.35,41.4,41.45,41.5,41.55,41.6,41.65,41.7,41.75,41.8,41.85,41.9,41.95,42.0,42.05,42.1,42.15,42.2,42.25,42.3,42.35,42.4,42.45,42.5,42.55,42.6,42.65,42.7,42.75,42.8,42.85,42.9,42.95,43.0,43.05,43.1,43.15,43.2,43.25,43.3,43.35,43.4,43.45,43.5,43.55,43.6,43.65,43.7,43.75,43.8,43.85,43.9,43.95,44.0,44.05,44.1,44.15,44.2,44.25,44.3,44.35,44.4,44.45,44.5,44.55,44.6,44.65,44.7,44.75,44.8,44.85,44.9,44.95,45.0,45.05,45.1,45.15,45.2,45.25,45.3,45.35,45.4,45.45,45.5,45.55,45.6,45.65,45.7,45.75,45.8,45.85,45.9,45.95,46.0,46.05,46.1,46.15,46.2,46.25,46.3,46.35,46.4,46.45,46.5,46.55,46.6,46.65,46.7,46.75,46.8,46.85,46.9,46.95,47.0,47.05,47.1,47.15,47.2,47.25,47.3,47.35,47.4,47.45,47.5,47.55,47.6,47.65,47.7,47.75,47.8,47.85,47.9,47.95,48.0],"baseline":{"label":"Baseline","hypothetical":false,"clearanceLPerH":18.0,"concentrationMgPerL":[0.0,0.048829,0.095378,0.13974,0.182003,0.222252,0.260569,0.297032,0.331716,0.364694,0.396036,0.425808,0.454074,0.480895,0.506331,0.53044,0.553274,0.574887,0.595329,0.614648,0.632891,0.650102,0.666324,0.681599,0.695965,0.709461,0.722123,0.733986,0.745084,0.755448,0.765111,0.774101,0.782447,0.790177,0.797316,0.803891,0.809926,0.815443,0.820465,0.825014,0.82911,0.832774,0.836023,0.838877,0.841352,0.843466,0.845235,0.846675,0.847799,0.848623,0.84916,0.849423,0.849426,0.849179,0.848695,0.847985,0.847059,0.845928,0.844602,0.843089,0.8414,0.839543,0.837526,0.835357,0.833044,0.830594,0.828015,0.825312,0.822494,0.819565,0.816531,0.813399,0.810175,0.806862,0.803467,0.799993,0.796447,0.792832,0.789152,0.785411,0.781615,0.777765,0.773866,0.769921,0.765933,0.761906,0.757843,0.753746,0.749618,0.745462,0.741281,0.737076,0.732851,0.728607,0.724346,0.720071,0.715783,0.711484,0.707176,0.702861,0.69854,0.694215,0.689887,0.685558,0.681228,0.6769,0.672575,0.668253,0.663936,0.659624,0.655319,0.651022,0.646734,0.642455,0.638186,0.633929,0.629683,0.625449,0.621229,0.617023,0.612831,0.608653,0.604492,0.600346,0.596217,0.592104,0.588009,0.583931,0.579872,0.575831,0.571809,0.567806,0.563822,0.559858,0.555913,0.551989,0.548085,0.544202,0.540339,0.536497,0.532677,0.528877,0.525099,0.521342,0.517607,0.513893,0.510201,0.506531,0.502883,0.499256,0.495652,0.492069,0.488509,0.484971,0.481454,0.47796,0.474488,0.471038,0.46761,0.464204,0.460819,0.457457,0.454117,0.450799,0.447503,0.444228,0.440975,0.437744,0.434535,0.431347,0.42818,0.425035,0.421912,0.418809,0.415728,0.412668,0.40963,0.406612,0.403614,0.400638,0.397683,0.394748,0.391833,0.388939,0.386065,0.383212,0.380378,0.377565,0.374771,0.371997,0.369243,0.366509,0.363794,0.361098,0.358421,0.355764,0.353126,0.350507,0.347906,0.345324,0.342761,0.340216,0.33769,0.335182,0.332692,0.33022,0.327766,0.32533,0.322912,0.320511,0.318127,0.315761,0.313412,0.311081,0.308766,0.306468,0.304187,0.301923,0.299676,0.297444,0.29523,0.293031,0.290848,0.288682,0.286532,0.284397,0.282278,0.280175,0.278087,0.276014,0.273957,0.271915,0.269888,0.267876,0.265879,0.263896,0.261928,0.259975,0.258036,0.256112,0.254202,0.252306,0.250424,0.248556,0.246701,0.244861,0.243034,0.241221,0.239421,0.237634,0.235861,0.234101,0.232354,0.23062,0.228898,0.22719,0.225494,0.223811,0.22214,0.220482,0.218836,0.217203,0.215581,0.213972,0.212374,0.210789,0.209215,0.207653,0.206102,0.204564,0.203036,0.20152,0.200015,0.198522,0.197039,0.195568,0.194107,0.192658,0.191219,0.189791,0.188373,0.186967,0.18557,0.184184,0.182809,0.181443,0.180088,0.178743,0.177408,0.176083,0.174768,0.173462,0.172167,0.170881,0.169604,0.168337,0.16708,0.165832,0.164593,0.163364,0.162143,0.160932,0.15973,0.158537,0.157352,0.156177,0.15501,0.153852,0.152703,0.151562,0.15043,0.149306,0.148191,0.147083,0.145985,0.144894,0.143812,0.142737,0.141671,0.140612,0.139562,0.138519,0.137484,0.136457,0.135438,0.134426,0.133421,0.132425,0.131435,0.130453,0.129479,0.128511,0.127551,0.126598,0.125652,0.124714,0.123782,0.122857,0.121939,0.121028,0.120124,0.119226,0.118335,0.117451,0.116574,0.115703,0.114838,0.11398,0.113129,0.112283,0.111445,0.110612,0.109785,0.108965,0.108151,0.107343,0.106541,0.105745,0.104955,0.104171,0.103392,0.10262,0.101853,0.101092,0.100337,0.099587,0.098843,0.098104,0.097371,0.096644,0.095922,0.095205,0.094494,0.093788,0.093087,0.092391,0.091701,0.091016,0.090336,0.089661,0.088991,0.088326,0.087666,0.087011,0.086361,0.085716,0.085075,0.084439,0.083809,0.083182,0.082561,0.081944,0.081332,0.080724,0.080121,0.079522,0.078928,0.078338,0.077753,0.077172,0.076595,0.076023,0.075455,0.074891,0.074332,0.073776,0.073225,0.072678,0.072135,0.071596,0.071061,0.07053,0.070003,0.06948,0.068961,0.068445,0.067934,0.067426,0.066923,0.066423,0.065926,0.065434,0.064945,0.06446,0.063978,0.0635,0.063025,0.062554,0.062087,0.061623,0.061163,0.060706,0.060252,0.059802,0.059355,0.058912,0.058471,0.058034,0.057601,0.05717,0.056743,0.056319,0.055899,0.055481,0.055066,0.054655,0.054246,0.053841,0.053439,0.05304,0.052643,0.05225,0.051859,0.051472,0.051087,0.050706,0.050327,0.049951,0.049578,0.049207,0.048839,0.048474,0.048112,0.047753,0.047396,0.047042,0.04669,0.046342,0.045995,0.045652,0.04531,0.044972,0.044636,0.044302,0.043971,0.043643,0.043317,0.042993,0.042672,0.042353,0.042036,0.041722,0.041411,0.041101,0.040794,0.040489,0.040187,0.039887,0.039588,0.039293,0.038999,0.038708,0.038418,0.038131,0.037846,0.037564,0.037283,0.037004,0.036728,0.036454,0.036181,0.035911,0.035642,0.035376,0.035112,0.034849,0.034589,0.034331,0.034074,0.03382,0.033567,0.033316,0.